platform,asin,title,brand,category,current_price,original_price,discount,rating,reviews_count,prime_eligible,amazon_choice,sponsored,main_image,product_url,scraped_at
amazon,B0D27LFJWL,"Cord Organizer For Kitchen Appliances, Pack of 3, Flexable Adhesive Cord Winder Wrapper Holder, Cable Organizer for Home Appliances, Computers, TV, Cord Keeper on Stand Mixer, White, Black and Grey.",,Appliances,EGP 65.55,,,2.5,,,,,https://m.media-amazon.com/images/I/61-eAH8Qk7L._AC_UL320_.jpg,https://www.amazon.eg/dp/B0D27LFJWL,2026-03-27T18:42:17.776041
amazon,B0FPD2GTQ6,MySouqEg - Store - Title: Split Lunch Box – 1.5L RIO Home Appliances (Light Blue) 1pcs 21cm*14cm,,Appliances,EGP 455.00,,,,,,,,https://m.media-amazon.com/images/I/413p0K0KOzL._AC_UL320_.jpg,https://www.amazon.eg/dp/B0FPD2GTQ6,2026-03-27T18:42:17.777045
amazon,B0FF2NMVYF,Donuts Master - Donuts & Waffle Making Delicious (High Quality) Get the most delicious waffles and donuts easily with Mini Waffle & Donuts Machine Unique Experience - Generic,,Appliances,,,,3.0,,,,,https://m.media-amazon.com/images/I/51lDFjDQLOL._AC_UL320_.jpg,https://www.amazon.eg/dp/B0FF2NMVYF,2026-03-27T18:42:17.777530
amazon,B0FM8LHPRM,Washing Machine Legs - Set of 4 Anti-Vibration Feet for Stabilizing and Supporting Home Appliances to Reduce Noise and Movement During Operation,,Appliances,EGP 231.32,,,,,,,,https://m.media-amazon.com/images/I/719n+B42NfL._AC_UL320_.jpg,https://www.amazon.eg/dp/B0FM8LHPRM,2026-03-27T18:42:17.777984
amazon,B0FXFS8BG6,"2-Tier Metal Microwave Organizer for Home Appliances, Spices, Space Saving, Durable Rustproof Construction for a Tidy and Modern Kitchen",,Appliances,EGP 455.60,,,1.0,,,,,https://m.media-amazon.com/images/I/41UJQ6rmhdL._AC_UL320_.jpg,https://www.amazon.eg/dp/B0FXFS8BG6,2026-03-27T18:42:17.778547
amazon,B0FSCV7Q18,"White Switch 250V, Set of 5, Pear Design for Lighting and Home Appliances",,Appliances,EGP 154.00,,,,,,,,https://m.media-amazon.com/images/I/41LhvyiWi0L._AC_UL320_.jpg,https://www.amazon.eg/dp/B0FSCV7Q18,2026-03-27T18:42:17.779572
amazon,B0DH5LFD89,Home Appliances (Makeup Organizer and Crystal Pens),,Appliances,EGP 225.00,,,4.0,,,,,https://m.media-amazon.com/images/I/41yyLraPpLL._AC_UL320_.jpg,https://www.amazon.eg/dp/B0DH5LFD89,2026-03-27T18:42:17.780238
amazon,B0FPRH8K1W,Multi Use Power Strip Overload Protection 7 Outlets with 2 USB Charging Ports – Safe Power Strip for Home Appliances – Practical Extension Cord for Organizing and Operating Devices,,Appliances,EGP 319.00,,,5.0,,,,,https://m.media-amazon.com/images/I/712tmfFH26L._AC_UL320_.jpg,https://www.amazon.eg/dp/B0FPRH8K1W,2026-03-27T18:42:17.780735
amazon,B09YV2MZR7,"OneNine Cord Organizer for Kitchen Appliances, Cord Wrap Cords Holder Small Home Appliances Wire Storage Cord Hider, Cable Organizer Wrapper for Mixer Blender Coffee Maker Pressure Cooker Air Fryer",,Appliances,EGP 89.00,,,1.9,,,,,https://m.media-amazon.com/images/I/61cu-75rGTL._AC_UL320_.jpg,https://www.amazon.eg/dp/B09YV2MZR7,2026-03-27T18:42:17.781280
amazon,B0CMHV795K,"6-Piece Cable Organizer for Home Appliances, Adhesive Cable Winder, TPR Material, Grey, White, Black",,Appliances,EGP 102.00,,,3.0,,,,,https://m.media-amazon.com/images/I/514avT2tHjL._AC_UL320_.jpg,https://www.amazon.eg/dp/B0CMHV795K,2026-03-27T18:42:17.781788
amazon,B0D3JFDMH8,NEWELLOK 6 Pcs Kitchen Tool Cord Organizer Adhesive Wire Wrap Holder Cable Organizer for Home Appliances Mixer Stand Coffee Maker,,Appliances,EGP 170.00,,,4.0,,,,,https://m.media-amazon.com/images/I/51YeYZEHl7L._AC_UL320_.jpg,https://www.amazon.eg/dp/B0D3JFDMH8,2026-03-27T18:42:17.782311
amazon,B0DTBTVPL4,"NextStore 14 in 1 Power Strip - 8 Power Sockets, 6 Ports (USB-A, USB-C), PD/QC Fast Charging, 2 Meter Length, 2500W, Multi Use for Home Appliances - Black",,Appliances,"EGP 1,900.00","EGP 2,553.60",,5.0,List:,,,,https://m.media-amazon.com/images/I/51js+tS0drL._AC_UL320_.jpg,https://www.amazon.eg/dp/B0DTBTVPL4,2026-03-27T18:42:17.782900
amazon,B0CJ9KH4K8,"128 in 1 Precision Screwdriver Set: Magnetic Driver Kit, Cylinder Screw Set, Professional Repair Tool Kit for Electronic Home Appliance Etc",,Appliances,"EGP 1,222.00",,,3.8,,,,,https://m.media-amazon.com/images/I/71FYHzeK0WL._AC_UL320_.jpg,https://www.amazon.eg/dp/B0CJ9KH4K8,2026-03-27T18:42:17.783442
amazon,B08JXCS3PC,Krueis Refrigerator Dust Cover Home Appliance Waterproof Dust Cover Hanging Bag (Floral),,Appliances,EGP 69.00,,,2.3,,,,,https://m.media-amazon.com/images/I/51KBRke0HPL._AC_UL320_.jpg,https://www.amazon.eg/dp/B08JXCS3PC,2026-03-27T18:42:17.783976
amazon,B0FBX5B6XC,WAFFLETO - Electric Miniature Waffle Maker (Imported) 350W Compact and Easy to Use Design Perfect for Making Delicious Waffle at Home.An Invaluable Addition - Generic,,Appliances,,,,,,,,,https://m.media-amazon.com/images/I/51tfZLJKSfL._AC_UL320_.jpg,https://www.amazon.eg/dp/B0FBX5B6XC,2026-03-27T18:42:17.785350
amazon,B0B65KYB9D,"PVC 3D Wall Panel Diamond for Interior Wall Décor in White, Wall Décor PVC Panel, 3D Textured Wall Panels (50X50) Cm (1)",,Appliances,EGP 750.00,,,,,,,,https://m.media-amazon.com/images/I/41Bn8d59pYL._AC_UL320_.jpg,https://www.amazon.eg/dp/B0B65KYB9D,2026-03-27T18:42:17.785783
amazon,B0F8QG6MBL,"Rana Store Safety Lock for Cabinets and Home Appliances, Easy Installation, Ideal for Child Protection (1 Piece, Grey)",,Appliances,EGP 119.00,,,,,,,,https://m.media-amazon.com/images/I/51tC77g7-vL._AC_UL320_.jpg,https://www.amazon.eg/dp/B0F8QG6MBL,2026-03-27T18:42:17.786268
amazon,B091CXXLXJ,Blender jar for menta ch-645 - imported,,Appliances,EGP 450.00,,,3.8,,,,,https://m.media-amazon.com/images/I/61wrGeGkecL._AC_UL320_.jpg,https://www.amazon.eg/dp/B091CXXLXJ,2026-03-27T18:42:17.786774
amazon,B0GF49CRJH,Microwave Dish Rotator Motor Home Appliance Synchronizer Motor,,Appliances,EGP 300.00,,,1.0,,,,,https://m.media-amazon.com/images/I/41TVE2wgiJL._AC_UL320_.jpg,https://www.amazon.eg/dp/B0GF49CRJH,2026-03-27T18:42:17.787295
amazon,B091JVNGHY,Braun Spare Parts Potato Chips Slicer For Multiquick Combimax Food Processor,,Appliances,EGP 110.00,,,3.6,,,,,https://m.media-amazon.com/images/I/51E93ZOTHtL._AC_UL320_.jpg,https://www.amazon.eg/dp/B091JVNGHY,2026-03-27T18:42:17.787806
amazon,B091J89FTY,Braun Spare Parts - Orange Juicer Filter For Multiquick Combimax Food Processor,,Appliances,EGP 350.00,,,5.0,,,,,https://m.media-amazon.com/images/I/619GFIARCdL._AC_UL320_.jpg,https://www.amazon.eg/dp/B091J89FTY,2026-03-27T18:42:17.788344
amazon,B08JQBKKB8,"Ariete Party Time 2973 Cotton Candy Maker for Sugar, Hard Candy Floss Maker with Dispenser, 4 Cones, 450 Watts, Blue (By De'longhi Group)",,Appliances,,,,4.4,,,,,https://m.media-amazon.com/images/I/61aonojt7EL._AC_UL320_.jpg,https://www.amazon.eg/dp/B08JQBKKB8,2026-03-27T18:42:21.719201
amazon,B0BX9GJ2S1,Fresh 4Pcs Anti Vibration pads Anti Walking Pads Washing Machine Dryer Support Prevent Shock Noise Cancelling Rubber Feet Pads for Home Appliances Prevent Moving Jitter Universal Size,,Appliances,EGP 27.00,,,3.6,,,,,https://m.media-amazon.com/images/I/71U9uAthRPL._AC_UL320_.jpg,https://www.amazon.eg/dp/B0BX9GJ2S1,2026-03-27T18:42:21.719711
amazon,B0G35TBRFP,"Tlatat Pieces Home Refrigerator and Freezer Safety Lock, Easy to Install, Compatible with All Types of Doors Lock Refrigerator Adjustable 360 Degree Multi-Color",,Appliances,EGP 119.99,,,4.3,,,,,https://m.media-amazon.com/images/I/41nCPEXKK+L._AC_UL320_.jpg,https://www.amazon.eg/dp/B0G35TBRFP,2026-03-27T18:42:21.720252
amazon,B0DGHLY43X,Electrical Protector with 2 Volt and Amp Displays – 80 VA – Protect Devices from Electricity Fluctuations – LED Digital Display – Compatible with Home Appliances - SP3-80VA,,Appliances,EGP 580.00,EGP 595.00,,4.3,List:,,,,https://m.media-amazon.com/images/I/41IBACBEXKL._AC_UL320_.jpg,https://www.amazon.eg/dp/B0DGHLY43X,2026-03-27T18:42:21.723545
amazon,B0DB2WC9K1,"Furniture Lifter Mover Tool Set Furniture Lifting Tool/Furniture Mover Lifter, Heavy Load Moving Wheels for Furniture Household Furniture Lifter and Rollers Set for Home Appliance",,Appliances,EGP 170.00,,,3.4,,,,,https://m.media-amazon.com/images/I/41NV8RixleL._AC_UL320_.jpg,https://www.amazon.eg/dp/B0DB2WC9K1,2026-03-27T18:42:21.724565
amazon,B0DZ756HF6,"Metal Microwave Organizer Rack – Expandable Stand with Sturdy Surface to Hold Heavy Weights, Ideal for Keeping Appliances and Utensils in Neat Arrangement – FASHION.HOME",,Appliances,"EGP 1,890.14",,,1.0,,,,,https://m.media-amazon.com/images/I/61N3Ieb4N2L._AC_UL320_.jpg,https://www.amazon.eg/dp/B0DZ756HF6,2026-03-27T18:42:21.725071
amazon,B0FM8TLTKK,"Dust & Grease Barrier - Versatile Appliance Filter for Homes and Kitchens, Stops Dirt and Grease from Accumulating, Easy to Replace, Maintains Peak Performance, and Keeps Your Hood and AC Clean",,Appliances,EGP 355.00,,,,,,,,https://m.media-amazon.com/images/I/51kmP0zz5bL._AC_UL320_.jpg,https://www.amazon.eg/dp/B0FM8TLTKK,2026-03-27T18:42:21.730431
amazon,B0FN4WHNZW,Household Appliances (Green Square Carpet Racket),,Appliances,EGP 105.00,,,3.4,,,,,https://m.media-amazon.com/images/I/51K2Lyp5NWL._AC_UL320_.jpg,https://www.amazon.eg/dp/B0FN4WHNZW,2026-03-27T18:42:21.730932
amazon,B0G6PFCBWL,Adjustable Washing Machine Stand with Anti-Vibration Shock Absorbers Lifting Base Protects from Water and Rust 4 Pieces for Home Appliances,,Appliances,EGP 125.00,,,,,,,,https://m.media-amazon.com/images/I/41AFiyRiQVL._AC_UL320_.jpg,https://www.amazon.eg/dp/B0G6PFCBWL,2026-03-27T18:42:21.731883
amazon,B091D4HV7J,Plastic Dispenser for Pancake and Crepe Batter - Beige,,Appliances,EGP 109.00,,,3.0,,,,,https://m.media-amazon.com/images/I/51mQLmX9g+L._AC_UL320_.jpg,https://www.amazon.eg/dp/B091D4HV7J,2026-03-27T18:42:21.732402
amazon,B0FG436F3K,Furniture Lifter - Heavy-duty mover set with versatile lifting tool and durable wheels designed for effortless relocation of heavy furniture and appliances at home,,Appliances,EGP 594.01,,,4.0,,,,,https://m.media-amazon.com/images/I/615GAl2D9BL._AC_UL320_.jpg,https://www.amazon.eg/dp/B0FG436F3K,2026-03-27T18:42:21.732889
amazon,B0GF45YGFJ,"Washing Machine Filter Compatible with Ideal Zenussi 18, 14 Programs, White Home Appliance Accessories",,Appliances,EGP 300.00,,,,,,,,https://m.media-amazon.com/images/I/61RmNuc0VbL._AC_UL320_.jpg,https://www.amazon.eg/dp/B0GF45YGFJ,2026-03-27T18:42:21.737375
amazon,B0FSLNDK76,"LOGO Kitchen Cleaner, Kitchen Cleaning Spray, Orange, Multipurpose Cleaner for Kitchen and Home Appliances",,Appliances,EGP 105.00,,,,,,,,https://m.media-amazon.com/images/I/61KqFuDfyqL._AC_UL320_.jpg,https://www.amazon.eg/dp/B0FSLNDK76,2026-03-27T18:42:21.738829
amazon,B091KJ47L3,Braun - Spare Parts Mincer Blade,,Appliances,EGP 850.00,,,4.6,,,,,https://m.media-amazon.com/images/I/51vRutvNDeL._AC_UL320_.jpg,https://www.amazon.eg/dp/B091KJ47L3,2026-03-27T18:42:21.739877
amazon,B091JGCW27,"Moulinex Spare Parts Juicer Filter For Food Processor Models Dfc3, Dfc6, Fp7331, Fp7361, Fp7371",,Appliances,EGP 250.00,,,5.0,,,,,https://m.media-amazon.com/images/I/61oNLo0eskL._AC_UL320_.jpg,https://www.amazon.eg/dp/B091JGCW27,2026-03-27T18:42:21.740414
amazon,B091JX8YC4,"Moulinex Spare Parts Fruits Juicer Cover For Food Processor Models Dfc3, Dfc6, Fp7331, Fp7361, Fp7371",,Appliances,EGP 350.00,,,5.0,,,,,https://m.media-amazon.com/images/I/61j49A3kKEL._AC_UL320_.jpg,https://www.amazon.eg/dp/B091JX8YC4,2026-03-27T18:42:21.740923
amazon,B0C3HR5G4Q,A to Z Hub GT Multipurpose Wall Mount Microwave Oven Rack - Metal Holder Storage Stand - Cooker Utensils Dish Shelf Organizer with Hooks for Home & Kitchen Appliances,,Appliances,EGP 900.00,EGP 926.00,,4.0,Was:,,,,https://m.media-amazon.com/images/I/613H7f8DUEL._AC_UL320_.jpg,https://www.amazon.eg/dp/B0C3HR5G4Q,2026-03-27T18:42:25.783771
amazon,B0C6GL6CB3,Silicon Appliances Cord Wrap Organizer With Double Face Tape For Home - Grey,,Appliances,EGP 23.00,,,1.9,,,,,https://m.media-amazon.com/images/I/41JOsYQdloL._AC_UL320_.jpg,https://www.amazon.eg/dp/B0C6GL6CB3,2026-03-27T18:42:25.784303
amazon,B0B5WTMCXB,"Candy flip Drum Washing Machine Refrigerator Mobile Base, Washing Machine Stand Multi Functional Movable Adjustable Base, Appliances Roller Pairs Heavy Duty, for Dryer and Refrigerator (2 Pcs)",,Appliances,EGP 179.10,,,3.5,,,,,https://m.media-amazon.com/images/I/61B1iIQ0WvL._AC_UL320_.jpg,https://www.amazon.eg/dp/B0B5WTMCXB,2026-03-27T18:42:25.789666
amazon,B0DYVP7VJM,"KaberTrade Car Fuse Card, Home Appliances and More Replacement Kit for Small Cars, Trucks, Boats (25 Amp Fuse - 10 Count) - KaberTrade",,Appliances,EGP 79.00,,,5.0,,,,,https://m.media-amazon.com/images/I/512AVe0-MtL._AC_UL320_.jpg,https://www.amazon.eg/dp/B0DYVP7VJM,2026-03-27T18:42:25.792135
amazon,B0DYVQHFJ1,"KaberMisr 2020 Car Fuse Card, Home Appliances and More Replacement Kit for Small Cars, Trucks, Boats (16A Fuse - 10 Pack)",,Appliances,EGP 79.00,,,,,,,,https://m.media-amazon.com/images/I/51-eInHZj9L._AC_UL320_.jpg,https://www.amazon.eg/dp/B0DYVQHFJ1,2026-03-27T18:42:25.792567
amazon,B0BC8SBQSZ,"Cord Organizer for Kitchen Appliances, 6 Pack Cord Wrap Holder Cable Organizer for Small Home Appliances, Mixer, Blender, Coffee Maker, Pressure Cooker and Air Fryer…",,Appliances,EGP 148.00,,,4.2,,,,,https://m.media-amazon.com/images/I/5137R9FYWkL._AC_UL320_.jpg,https://www.amazon.eg/dp/B0BC8SBQSZ,2026-03-27T18:42:25.793597
amazon,B0CZNFP65G,"Set of 8 Furniture Wall Anchors, Metal Brackets Anti-tipping Furniture, No Drilling for Drawers, Cabinets, Bookcases, Drawers, Home Appliances (Transparent)",,Appliances,EGP 240.00,,,4.1,,,,,https://m.media-amazon.com/images/I/61asdJpSEEL._AC_UL320_.jpg,https://www.amazon.eg/dp/B0CZNFP65G,2026-03-27T18:42:25.796650
amazon,B0DSFYFGHM,"Air Fryer Cover - Elegant Lace Dust Cover for Your Air Fryer, Perfect for Keeping Your Kitchen Appliances Clean and Neat, Perfect for Home Decoration and Special Occasion Gifts.(1 Piece)",,Appliances,EGP 278.84,,,,,,,,https://m.media-amazon.com/images/I/813gu3PLlyL._AC_UL320_.jpg,https://www.amazon.eg/dp/B0DSFYFGHM,2026-03-27T18:42:25.797545
amazon,B09232C3CZ,"Other Gas Hose, Black, Kitchen, Gas Appliances, Home Improvement",,Appliances,EGP 225.00,,,,,,,,https://m.media-amazon.com/images/I/31QL1HiMtvS._AC_UL320_.jpg,https://www.amazon.eg/dp/B09232C3CZ,2026-03-27T18:42:25.798423
amazon,B0DSFVHPTX,"Air Fryer Cover - Elegant Lace Dust Cover for Your Air Fryer, Perfect for Keeping Your Kitchen Appliances Dust Free and Neat, Perfect for Home Decoration and Gift Giving.(1 Pcs)",,Appliances,EGP 290.18,,,,,,,,https://m.media-amazon.com/images/I/813gu3PLlyL._AC_UL320_.jpg,https://www.amazon.eg/dp/B0DSFVHPTX,2026-03-27T18:42:25.798842
amazon,B0GFY2HCNJ,3 Pcs Cleaning Towel Set 35 x 35 cm High Water Absorption Dust-Free Lint Free Scratch Free for Home Kitchen Bathroom Glass Daily Appliances,,Appliances,EGP 123.25,,,,,,,,https://m.media-amazon.com/images/I/71ICI2tC0aL._AC_UL320_.jpg,https://www.amazon.eg/dp/B0GFY2HCNJ,2026-03-27T18:42:25.799345
amazon,B0CC1GQZYT,"Refrigerator Dust Cloth,multipurpose Proof Cover Washing Machine Waterproof Cover With Storage Pockets Bags,for Oven,dishwasher,kitchen Appliances",,Appliances,EGP 110.00,,,4.0,,,,,https://m.media-amazon.com/images/I/710wDeLmZiL._AC_UL320_.jpg,https://www.amazon.eg/dp/B0CC1GQZYT,2026-03-27T18:42:25.800845
amazon,B09MF9P7HR,"SI FANG Expandable Appliance Rollers, Adjustable Washing Machine Base with Locking Wheels, Heavy Duty Mobile Roller Stand for Washer and Dryer, Refrigerators, Adjusts from 18"" to 27.6""(White)",,Appliances,EGP 322.00,,,,,,,,https://m.media-amazon.com/images/I/51dR0ER01cL._AC_UL320_.jpg,https://www.amazon.eg/dp/B09MF9P7HR,2026-03-27T18:42:25.802274
amazon,B0FXVZ2X9P,"Plastic Surface Restorer Spray – UV Damage Repair – Deep Oxidation Removal – For Car Interior, Exterior, Vinyl, Leather, and Home Appliances – 120ml Scented Bottle",,Appliances,,,,,,,,,https://m.media-amazon.com/images/I/31x7U-lx43L._AC_UL320_.jpg,https://www.amazon.eg/dp/B0FXVZ2X9P,2026-03-27T18:42:25.803201
amazon,B091JMLRQ5,Braun Spare Parts Fruits Juicer Cover For Multiquick Combimax Food Processor,,Appliances,EGP 390.00,,,3.0,,,,,https://m.media-amazon.com/images/I/51c+udbOHUL._AC_UL320_.jpg,https://www.amazon.eg/dp/B091JMLRQ5,2026-03-27T18:42:28.984359
amazon,B091JMJ66B,"Moulinex Spare Parts Juicer Head For Food Processor Models Dfc3, Dfc6, Fp7331, Fp7361, Fp7371",,Appliances,EGP 380.00,,,4.6,,,,,https://m.media-amazon.com/images/I/51fkm6e+nCL._AC_UL320_.jpg,https://www.amazon.eg/dp/B091JMJ66B,2026-03-27T18:42:28.984864
amazon,B0G61DQDGY,"1000W Electric Cooking Hot Plate – Heavy-Duty Single Burner for Tea, Coffee, Meals & Food Warming – Ideal for Home, Travel & Small Kitchens",,Appliances,EGP 483.00,,,,,,,,https://m.media-amazon.com/images/I/51MOMha8yrL._AC_UL320_.jpg,https://www.amazon.eg/dp/B0G61DQDGY,2026-03-27T18:42:28.985321
amazon,B0GQQF6MVJ,"Hot Air Popcorn Maker Machine with Reusable Popcorn Bucket, Oil-Free Electric Popcorn Popper, Fast & Healthy Snack Maker for Home, Movie Nights & Parties, Red",,Appliances,EGP 649.00,,,,,,,,https://m.media-amazon.com/images/I/71ycGKH2hYL._AC_UL320_.jpg,https://www.amazon.eg/dp/B0GQQF6MVJ,2026-03-27T18:42:28.985751
amazon,B0G1MZ2ZLQ,"B800 Multi Blender, 1.7 Liter Capacity",,Appliances,"EGP 3,998.00",,,,,,,,https://m.media-amazon.com/images/I/51eKoj2A4rL._AC_UL320_.jpg,https://www.amazon.eg/dp/B0G1MZ2ZLQ,2026-03-27T18:42:28.986261
amazon,B09K3Z4GGS,"VAIIEYO 4Pcs Shock & Noise Cancelling Washing Machine Support, Anti Slip Rubber Washing Machine Feet Pads, Washing Machine Stabilizer, Anti-Walking Rubber Pads for Home Appliances, Universal Size",,Appliances,EGP 40.00,,,3.3,,,,,https://m.media-amazon.com/images/I/71HdL8TENPL._AC_UL320_.jpg,https://www.amazon.eg/dp/B09K3Z4GGS,2026-03-27T18:42:28.986760
amazon,B08741M7DZ,"Kenwood Personal Blender 350W Smoothie Blender/Smoothie Maker With 570Ml & 400Ml Tritan Smoothie2Go Bottle And Lid, Ice Crush Function Blm05.A0Bk Black/Silver",,Appliances,"EGP 2,339.00",,,4.3,,,,,https://m.media-amazon.com/images/I/71I33riO0SL._AC_UL320_.jpg,https://www.amazon.eg/dp/B08741M7DZ,2026-03-27T18:42:28.987286
amazon,B09ZB6KY4T,Fresh Multifunctional Double Sided Adhesive Tape Reusable Waterproof Wall Sticker Non Marking Washable Self Adhesive For Home Appliances PVC Non marking (180),,Appliances,EGP 58.00,,,3.8,,,,,https://m.media-amazon.com/images/I/61l-0T003OL._AC_UL320_.jpg,https://www.amazon.eg/dp/B09ZB6KY4T,2026-03-27T18:42:28.987790
amazon,B097CJF26M,"Sonai Hand Mixer -5 Speeds and turbo function,300 Watt Black SH-M790",,Appliances,"EGP 1,070.00",,,5.0,,,,,https://m.media-amazon.com/images/I/61Cwob4SOYL._AC_UL320_.jpg,https://www.amazon.eg/dp/B097CJF26M,2026-03-27T18:42:28.988325
amazon,B09BDPRW1D,"Electric Ice Crusher small size 150 watt , 2724635452482",,Appliances,"EGP 4,250.00",,,,,,,,https://m.media-amazon.com/images/I/61UrpjieqrL._AC_UL320_.jpg,https://www.amazon.eg/dp/B09BDPRW1D,2026-03-27T18:42:28.988747
amazon,B0FRFKNBH5,"Premsons® Popcorn Maker – Hot Air Popcorn Machine for Oil-Free, Healthy & Quick Snack Making | Portable & Easy to Use Popcorn Popper for Home & Parties",,Appliances,"EGP 8,969.99",,,5.0,,,,,https://m.media-amazon.com/images/I/81nyZSoEVbL._AC_UL320_.jpg,https://www.amazon.eg/dp/B0FRFKNBH5,2026-03-27T18:42:28.989271
amazon,B085CKRSBB,Moulinex XF242201 Grater Accessory,,Appliances,EGP 250.00,,,5.0,,,,,https://m.media-amazon.com/images/I/51mBO61uAaL._AC_UL320_.jpg,https://www.amazon.eg/dp/B085CKRSBB,2026-03-27T18:42:28.989776
amazon,B098W4BV1Y,Braun Hand Blender Spare Part Long Knife for Multi Quick Bowl (1250ml),,Appliances,EGP 349.90,,,4.0,,,,,https://m.media-amazon.com/images/I/41A-OhiUM3L._AC_UL320_.jpg,https://www.amazon.eg/dp/B098W4BV1Y,2026-03-27T18:42:28.990388
amazon,B0FRNPD6DV,"Innovative Tool Grape Leaf Rolling Machine for All Kinds of Paper: kale – Grape – Lettuce, and Tickling Equal Sizes for a Tidy Shape on the Sufra (Pack of 1)",,Appliances,EGP 265.00,,,,,,,,https://m.media-amazon.com/images/I/51RLdv2F00L._AC_UL320_.jpg,https://www.amazon.eg/dp/B0FRNPD6DV,2026-03-27T18:42:28.990830
amazon,B0FVZD73H6,Electric Kettle 2L Stainless Steel Fast Boil 2200W With Auto Shut-Off And 360° Rotating Base Cool Touch Handle For Home Office Kitchen,,Appliances,"EGP 3,755.00",,,,,,,,https://m.media-amazon.com/images/I/5196Iq8b7NL._AC_UL320_.jpg,https://www.amazon.eg/dp/B0FVZD73H6,2026-03-27T18:42:28.991319
amazon,B091JB5Z18,"Moulinex Spare Parts Juicer Shaft For Food Processor Models Dfc3, Dfc6, Fp7331, Fp7361, Fp7371",,Appliances,EGP 320.00,,,4.3,,,,,https://m.media-amazon.com/images/I/51s0hNAxKhL._AC_UL320_.jpg,https://www.amazon.eg/dp/B091JB5Z18,2026-03-27T18:42:28.991832
amazon,B0DMW9H9NS,"Mini Cooker, Portable Electric Cooker, Single Heating Surface, Non-Stick Coating, Overheat Protection System, 1000W for Home or Travel Cooking",,Appliances,EGP 578.42,,,,,,,,https://m.media-amazon.com/images/I/71SILZTKtnL._AC_UL320_.jpg,https://www.amazon.eg/dp/B0DMW9H9NS,2026-03-27T18:42:28.992284
amazon,B091J8MDTV,"Mienta Blender Grinder (White, Transparent, Models 242)",,Appliances,EGP 275.00,,,4.0,,,,,https://m.media-amazon.com/images/I/61DH3Ge2pFL._AC_UL320_.jpg,https://www.amazon.eg/dp/B091J8MDTV,2026-03-27T18:42:28.992794
amazon,B09231MFV7,"Braun Spare Parts Multi-Quick Hand Blender Ice Knife Bowl,1250ml",,Appliances,EGP 330.00,,,4.1,,,,,https://m.media-amazon.com/images/I/41kxcfxufiL._AC_UL320_.jpg,https://www.amazon.eg/dp/B09231MFV7,2026-03-27T18:42:28.993327
amazon,B091KLV5XV,Moulinex Spare parts – La moulinette chopper D56-AD56-AR360 bowl,,Appliances,EGP 185.00,,,3.6,,,,,https://m.media-amazon.com/images/I/51OsLzXKnzL._AC_UL320_.jpg,https://www.amazon.eg/dp/B091KLV5XV,2026-03-27T18:42:28.993831
amazon,B098TXVMP2,"Braun Spare Parts - Chopping Attachment 350 ml for MultiQuick Hand blender, MQ20 White, Non-Retail Packaging, Packaging May Vary",,Appliances,,,,3.8,,,,,https://m.media-amazon.com/images/I/61VB+xRvAEL._AC_UL320_.jpg,https://www.amazon.eg/dp/B098TXVMP2,2026-03-27T18:42:28.994321
amazon,B0DP38FK89,Appliance Installation Service - Washing Machine - 3 Units,,Appliances,EGP 810.00,,,,,,,,https://m.media-amazon.com/images/I/71t-OdPO2IL._AC_UL320_.jpg,https://www.amazon.eg/dp/B0DP38FK89,2026-03-27T18:42:28.994706
amazon,B091JRJHPG,SY blade assembly for commercial blender,,Appliances,EGP 370.00,,,3.8,,,,,https://m.media-amazon.com/images/I/51Hfo6r1SuL._AC_UL320_.jpg,https://www.amazon.eg/dp/B091JRJHPG,2026-03-27T18:42:28.995223
amazon,B0FS33ZNWF,"Heavy Duty Octagon Aluminum Gas Base with 4 Strong 360° Swivel Wheels – Suitable for Large Water Bottles, Barrels, Gas Cylinders and Home Appliances",,Appliances,EGP 550.00,,,5.0,,,,,https://m.media-amazon.com/images/I/61-LR3XITML._AC_UL320_.jpg,https://www.amazon.eg/dp/B0FS33ZNWF,2026-03-27T18:42:28.995716
amazon,B0993RVV8H,For Braun Spare Parts - Bowl Knife 500ml 4191,,Appliances,EGP 724.00,,,1.0,,,,,https://m.media-amazon.com/images/I/417xiDnEwkL._AC_UL320_.jpg,https://www.amazon.eg/dp/B0993RVV8H,2026-03-27T18:42:28.996233
amazon,B09693K9R6,Mienta Plastic Toaster - 2 Slices - 800 Watt,,Appliances,"EGP 2,779.00",,,5.0,,,,,https://m.media-amazon.com/images/I/61ud-p2hDvL._AC_UL320_.jpg,https://www.amazon.eg/dp/B09693K9R6,2026-03-27T18:42:28.996722
amazon,B097DK41H3,Zada ZKT-100SS Stainless Steel Electric Kettle - 1.8 Liters,,Appliances,,,,3.0,,,,,https://m.media-amazon.com/images/I/61iDJeZdjYS._AC_UL320_.jpg,https://www.amazon.eg/dp/B097DK41H3,2026-03-27T18:42:28.997216
amazon,B097DK81GJ,Stainless Steel Electric Kettle - 1.5L,,Appliances,EGP 222.00,,,3.0,,,,,https://m.media-amazon.com/images/I/61w+hyg0FyL._AC_UL320_.jpg,https://www.amazon.eg/dp/B097DK81GJ,2026-03-27T18:42:28.997706
amazon,B093TJV7ZY,"Braun Breakfast1 Collection WK1100BK Kettle, Removable 360° Rotating Base, Limescale Filter, 1.7 Liters Capacity, BPA Free, 2200W, Plastic, Black",,Appliances,,,,4.3,,,,,https://m.media-amazon.com/images/I/419iClmmfdL._AC_UL320_.jpg,https://www.amazon.eg/dp/B093TJV7ZY,2026-03-27T18:42:28.998202
amazon,B09B3158DT,Braun Spare Part Hand Blender Insert Carrier for MultiQuick,,Appliances,EGP 169.87,,,5.0,,,,,https://m.media-amazon.com/images/I/51uKoAxVDtL._AC_UL320_.jpg,https://www.amazon.eg/dp/B09B3158DT,2026-03-27T18:42:28.998750
amazon,B096QZ1D2Z,Coffee Maker Alcohol Burner - 1-2725605721348,,Appliances,EGP 320.00,,,2.7,,,,,https://m.media-amazon.com/images/I/71hl6lCSIFL._AC_UL320_.jpg,https://www.amazon.eg/dp/B096QZ1D2Z,2026-03-27T18:42:28.999315
amazon,B091K4NXGH,Braun Spare Parts Blender Jug Base Nut Jb3010 and Gasket,,Appliances,EGP 400.00,,,2.5,,,,,https://m.media-amazon.com/images/I/51XlDdU0BgL._AC_UL320_.jpg,https://www.amazon.eg/dp/B091K4NXGH,2026-03-27T18:42:28.999825
amazon,B09231DK69,"Braun Spare Parts Hand Blender Bowl Cover for Multiquick - (White,1250ml)",,Appliances,,,,4.2,,,,,https://m.media-amazon.com/images/I/41VOAYri0HL._AC_UL320_.jpg,https://www.amazon.eg/dp/B09231DK69,2026-03-27T18:42:29.000340
amazon,B0BWJVJ41D,Home GM-7091 Glass Kibbeh 350W 35.7 x 19.4 x 17.1 cm; 1.7 Kg - White,,Appliances,,,,,,,,,https://m.media-amazon.com/images/I/61SiOdGQnFL._AC_UL320_.jpg,https://www.amazon.eg/dp/B0BWJVJ41D,2026-03-27T18:42:29.000731
amazon,B08P3VNXM9,"Mintra Home Curly Collection (11.75in Bowl 2pk, Red)",,Appliances,EGP 81.23,,,4.2,,,,,https://m.media-amazon.com/images/I/81KhFYQXj8L._AC_UL320_.jpg,https://www.amazon.eg/dp/B08P3VNXM9,2026-03-27T18:42:29.001288
amazon,B0DJ9KSG2K,"Rosa Sandy Oval Casserole, 31 cm Size, Medium",,Appliances,,,,4.1,,,,,https://m.media-amazon.com/images/I/61r1HfbbOzL._AC_UL320_.jpg,https://www.amazon.eg/dp/B0DJ9KSG2K,2026-03-27T18:42:29.001774
